<!ELEMENT libreria (libro*)>
<!ELEMENT libro (titulo, autor+, genero+, precio)>
<!ELEMENT titulo (#PCDATA)>
<!ELEMENT autor (#PCDATA)>
<!ELEMENT genero (#PCDATA)>
<!ELEMENT precio (#PCDATA)>
<!ATTLIST libro id ID #REQUIRED>
